{
  "era": "Roughly forty years after the death of the old emperor — the one who pushed the borders out and spent the treasury doing it. The wars are over. So is the money. Court runs on consort families and eunuch secretaries now. Nothing has fallen; everyone can feel the best of it is behind them and is careful not to say so.",
  "established_frame": "The medicine of the period is intact and not in question: qi, the five phases, the correspondences of organ and season and flavour, wind as a vector of illness. That is the frame Xu Ping thinks in and the language his expertise is expressed in.",
  "off_the_table": [],
  "play_style": [
    "Two or three options and a \"Something else?\" at the close of a scene. Keep this.",
    "When narrative energy flags, move in time or space rather than finishing a scene out of duty.",
    "Substantial scenes, not terse ones. Player steers as we go.",
    "Stay inside the fiction. Xu Ping has interior thoughts. Do not step out to comment as narrator unless the player asks a direct question.",
    "PROSE 1. No negate-then-upgrade. Never \"It is not X. It is Y.\" or \"Not the feet. It is never the feet.\" State the thing once and move on.",
    "PROSE 2. Do not end a scene, or a section inside one, on a chime. No short freestanding aphoristic last line. End mid-action, or on something unresolved, or on something dull.",
    "PROSE 3. Never name the feeling. Behaviour and physical fact only. If a sentence explains what he felt underneath it all, cut the sentence.",
    "PROSE 4. Vary grouping. The rule of three is the default and must be resisted. Use one, two, four, five. Lists of three should be rare enough to notice.",
    "PROSE 5. Ration the em-dash aside and the \"which is\" appositive. At most one of each per scene. They are how commentary gets smuggled in while pretending to be terse.",
    "PROSE 6. His interiority is disorderly. He loops, repeats himself, does the arithmetic twice, gets distracted by the wrong thing, forgets he already thought it. No tidy itemised lists inside his head.",
    "PROSE 7. Carry ballast. Include detail that never pays off, sentences that do not land, a paragraph that goes nowhere. Not everything is significant. Denser paragraphs; short isolated ones are part of the drumbeat.",
    "TOUCHSTONE, reference not pastiche. Chekhov, A Dreary Story and Ward No. 6: an ageing physician who has lost the thread of his own life and cannot name what has gone. Steal the refusal to supply an emotional gloss, and endings that run out rather than conclude.",
    "TOUCHSTONE. Penelope Fitzgerald, The Beginning of Spring: a historical world explained to nobody, ever. Steal the ballast, and the confidence not to gloss the period for the reader.",
    "TOUCHSTONE. Simenon, the Maigret books and the romans durs: deliberately plain vocabulary, atmosphere carried by weather, rooms, food and the hour of the day. Steal the absence of rhetorical machinery.",
    "TOUCHSTONE, runner-up. Ishiguro, An Artist of the Floating World: an ageing professional circling his own decline, self-justifying, looping. Steal the disorderly interiority.",
    "The touchstones are targets, not a licence for pastiche. PROSE 1-7 are the enforceable rules; a Chekhovian gesture is not the same as actually withholding. All four are novelists of duration — their pacing cannot be borrowed inside a scene of a few hundred words, only their sentences.",
    "MOVE FASTER (player, fifth day). Bigger jumps in time, fewer quiet scenes, threads brought to a head within a few turns. Let answers land when they are earned."
  ],
  "scale": "One city. Mostly two market wards and the streets between them.",
  "setting": "Chang'an, capital of Han. The West Market and the walled wards around it.",
  "tone": "Scandinavian detective. Procedural pleasure and quiet dread running side by side on the same page — competence is what the reader enjoys, deterioration is what they dread. Rich in the detail of the craft: ingredients, weights, processing, diagnosis, rendered with the delight Xu Ping takes in them.",
  "what_can_exist": {
    "cost": "Nothing supernatural operates, so nothing has a price.",
    "mode": "materialist",
    "rules": [
      "Changed at the player's request on the fifth day: things are true and can be found out. Every anomaly in the Geng house has a real, mundane cause.",
      "The medicine of the period is intact. Nothing supernatural operates; people believe in it, and belief moves money and behaviour.",
      "Recording: once Xu Ping has established a fact, record it as fact. observed_not_explained is for what he has seen and does not yet understand."
    ]
  }
}
